<!ELEMENT CHARACTER (HEADFILES,BODYFILES,HEADPOSITION,LEFT_EYE,RIGHT_EYE,EYE_SCALE,TEETHS-TONGUE,HAIRPOSITION?)>

<!ELEMENT HEADFILES EMPTY>
<!ELEMENT BODYFILES EMPTY>
<!ELEMENT HEADPOSITION EMPTY>
<!ELEMENT LEFT_EYE EMPTY>
<!ELEMENT RIGHT_EYE EMPTY>
<!ELEMENT EYE_SCALE EMPTY>
<!ELEMENT TEETHS-TONGUE EMPTY>
<!ELEMENT HAIRPOSITION EMPTY>

<!ATTLIST HEADFILES vertices		CDATA	#REQUIRED>
<!ATTLIST HEADFILES fdps		CDATA	#REQUIRED>
<!ATTLIST HEADFILES indices		CDATA	#REQUIRED>
<!ATTLIST HEADFILES textured		CDATA	"0">
<!ATTLIST HEADFILES hair		CDATA	"">
<!ATTLIST HEADFILES texture_file	CDATA	"">
<!ATTLIST HEADFILES lips_texture	CDATA	"">
<!ATTLIST HEADFILES eyes_texture	CDATA	"">
<!ATTLIST BODYFILES mesh		CDATA	#REQUIRED>
<!ATTLIST BODYFILES hierarchy		CDATA	#REQUIRED>
<!ATTLIST BODYFILES bones		CDATA	#REQUIRED>
<!ATTLIST BODYFILES texture_file	CDATA	"">
<!ATTLIST LEFT_EYE x			CDATA	#REQUIRED>
<!ATTLIST LEFT_EYE y			CDATA	#REQUIRED>
<!ATTLIST LEFT_EYE z			CDATA	#REQUIRED>
<!ATTLIST RIGHT_EYE x			CDATA	#REQUIRED>
<!ATTLIST RIGHT_EYE y			CDATA	#REQUIRED>
<!ATTLIST RIGHT_EYE z			CDATA	#REQUIRED>
<!ATTLIST EYE_SCALE	factor		CDATA	#REQUIRED>
<!ATTLIST TEETHS-TONGUE x		CDATA	#REQUIRED>
<!ATTLIST TEETHS-TONGUE y		CDATA	#REQUIRED>
<!ATTLIST TEETHS-TONGUE z		CDATA	#REQUIRED>
<!ATTLIST HEADPOSITION	scale		CDATA	#REQUIRED>
<!ATTLIST HEADPOSITION x		CDATA	#REQUIRED>
<!ATTLIST HEADPOSITION y		CDATA	#REQUIRED>
<!ATTLIST HEADPOSITION z		CDATA	#REQUIRED>
<!ATTLIST HAIRPOSITION	scalex		CDATA	#REQUIRED>
<!ATTLIST HAIRPOSITION	scaley		CDATA	#REQUIRED>
<!ATTLIST HAIRPOSITION	scalez		CDATA	#REQUIRED>
<!ATTLIST HAIRPOSITION x		CDATA	#REQUIRED>
<!ATTLIST HAIRPOSITION y		CDATA	#REQUIRED>
<!ATTLIST HAIRPOSITION z		CDATA	#REQUIRED>
